Sender ID,Date,Message,Sentiment,Compound_Sentiment,Channel Name,Affiliated Channel,URLs,IP_Addresses,Hashes
478514542,2025-02-27 19:44:13,"Suspected Desorden hacker arrested for breaching 90 organizations
https://www.bleepingcomputer.com/news/security/suspected-desorden-hacker-arrested-for-breaching-90-organizations/

A suspected cyber criminal believed to have extorted companies under the name ""DESORDEN Group"" or ""ALTDOS"" has been arrested in Thailand for leaking the stolen data of over 90 organizations worldwide. [...]","{'neg': 0.328, 'neu': 0.672, 'pos': 0.0, 'compound': -0.9393}",-0.9393,Israel Cyber Alerts,,https://www.bleepingcomputer.com,,
604262457,2025-02-27 18:49:32,"CISA Releases Two Industrial Control Systems Advisories
https://www.cisa.gov/news-events/alerts/2025/02/27/cisa-releases-two-industrial-control-systems-advisories

CISA released two Industrial Control Systems (ICS) advisories on February 27, 2025. These advisories provide timely information about current security issues, vulnerabilities, and exploits surrounding ICS.

ICSA-25-058-01 Schneider Electric Communication Modules for Modicon M580 and Quantum Controllers (https://www.cisa.gov/news-events/ics-advisories/icsa-25-058-01)
 
ICSMA-25-058-01 Dario Health USB-C Blood Glucose Monitoring System Starter Kit Android Application (https://www.cisa.gov/news-events/ics-medical-advisories/icsma-25-058-01)
 

CISA encourages users and administrators to review newly released ICS advisories for technical details and mitigations.","{'neg': 0.05, 'neu': 0.889, 'pos': 0.061, 'compound': 0.2263}",0.2263,Israel Cyber Alerts,,"https://www.cisa.gov,https://www.cisa.gov,https://www.cisa.gov",,
478514542,2025-02-27 15:23:08,"Google’s SafetyCore App Secretly Scans All Photos on Android Devices
https://gbhackers.com/googles-safetycore-app-secretly-scans/

Recent revelations about Google’s SafetyCore app have ignited a firestorm of privacy debates, echoing Apple’s recent controversy over photo scanning. The app, silently installed on Android devices via system updates, enables on-device image analysis to detect sensitive content—a feature marketed as privacy-preserving but criticized for its lack of transparency. This incident underscores growing user unease […]
The post Google’s SafetyCore App Secretly Scans All Photos on Android Devices (https://gbhackers.com/googles-safetycore-app-secretly-scans/) appeared first on GBHackers Security | #1 Globally Trusted Cyber Security News Platform (https://gbhackers.com/).","{'neg': 0.092, 'neu': 0.802, 'pos': 0.106, 'compound': 0.1154}",0.1154,Israel Cyber Alerts,,"https://gbhackers.com,https://gbhackers.com,https://gbhackers.com",,
478514542,2025-02-27 15:22:11,"New “nRootTag” Attack Turns 1.5 Billion iPhones into Free Tracking Tools
https://gbhackers.com/new-nroottag-attack/

Security researchers have uncovered a novel Bluetooth tracking vulnerability in Apple’s Find My network – the system powering AirTags and device-finding capabilities across iPhones, iPads, and Macs. Dubbed “nRootTag,” the attack transforms nearly any Bluetooth-enabled computer or smartphone into an invisible tracking beacon using Apple’s infrastructure. With over 1.5 billion active Apple devices globally, this […]
The post New “nRootTag” Attack Turns 1.5 Billion iPhones into Free Tracking Tools (https://gbhackers.com/new-nroottag-attack/) appeared first on GBHackers Security | #1 Globally Trusted Cyber Security News Platform (https://gbhackers.com/).","{'neg': 0.079, 'neu': 0.712, 'pos': 0.208, 'compound': 0.9136}",0.9136,Israel Cyber Alerts,,"https://gbhackers.com,https://gbhackers.com,https://gbhackers.com",,
478514542,2025-02-27 12:44:16,"U.S. Soldier Charged in AT&T Hack Searched “Can Hacking Be Treason”
https://krebsonsecurity.com/2025/02/u-s-soldier-charged-in-att-hack-searched-can-hacking-be-treason/

A U.S. Army soldier who pleaded guilty last week to leaking phone records for high-ranking U.S. government officials searched online for non-extradition countries and for an answer to the question ""can hacking be treason?"" prosecutors in the case said Wednesday. The government disclosed the details in a court motion to keep the defendant in custody until he is discharged from the military.","{'neg': 0.099, 'neu': 0.901, 'pos': 0.0, 'compound': -0.765}",-0.765,Israel Cyber Alerts,,https://krebsonsecurity.com,,
478514542,2025-02-27 12:18:23,"Authorities Arrested Hacker Behind 90 Major Data Breaches Worldwide
https://gbhackers.com/authorities-arrested-hacker-2/

Cybersecurity firm Group-IB, alongside the Royal Thai Police and Singapore Police Force, announced the arrest of a prolific hacker linked to over 90 major data breaches across 25 countries, including 65 attacks in the Asia-Pacific region. The cybercriminal, operating under aliases ALTDOS, DESORDEN, GHOSTR, and 0mid16B, exfiltrated 13 terabytes of sensitive data between 2020 and 2025, targeting industries from healthcare […]
The post Authorities Arrested Hacker Behind 90 Major Data Breaches Worldwide (https://gbhackers.com/authorities-arrested-hacker-2/) appeared first on GBHackers Security | #1 Globally Trusted Cyber Security News Platform (https://gbhackers.com/).","{'neg': 0.108, 'neu': 0.826, 'pos': 0.067, 'compound': -0.6597}",-0.6597,Israel Cyber Alerts,,"https://gbhackers.com,https://gbhackers.com,https://gbhackers.com",,
478514542,2025-02-27 10:48:44,"Cisco Nexus Vulnerability Allows Attackers to Inject Malicious Commands
https://gbhackers.com/cisco-nexus-vulnerability-2/

Cisco Systems has issued a critical security advisory for a newly disclosed command injection vulnerability affecting its Nexus 3000 and 9000 Series Switches operating in standalone NX-OS mode. Tracked as CVE-2025-20161 (CVSSv3 score: 5.1), the flaw enables authenticated attackers with administrative privileges to execute arbitrary operating system commands with root-level permissions during software upgrade procedures. The vulnerability, […]
The post Cisco Nexus Vulnerability Allows Attackers to Inject Malicious Commands (https://gbhackers.com/cisco-nexus-vulnerability-2/) appeared first on GBHackers Security | #1 Globally Trusted Cyber Security News Platform (https://gbhackers.com/).","{'neg': 0.116, 'neu': 0.678, 'pos': 0.206, 'compound': 0.8074}",0.8074,Israel Cyber Alerts,,"https://gbhackers.com,https://gbhackers.com,https://gbhackers.com",,
478514542,2025-02-27 10:47:44,"New Wi-Fi Jamming Attack Can Disable Specific Devices
https://gbhackers.com/new-wi-fi-jamming-attack/

A newly discovered Wi-Fi jamming technique enables attackers to selectively disconnect individual devices from networks with surgical precision, raising alarms across cybersecurity and telecommunications industries. Researchers from Northeastern University and the University of Chicago uncovered this vulnerability in IEEE 802.11 protocols that underpin all modern Wi-Fi systems, demonstrating how targeted de-authentication attacks could disrupt smart […]
The post New Wi-Fi Jamming Attack Can Disable Specific Devices (https://gbhackers.com/new-wi-fi-jamming-attack/) appeared first on GBHackers Security | #1 Globally Trusted Cyber Security News Platform (https://gbhackers.com/).","{'neg': 0.139, 'neu': 0.736, 'pos': 0.125, 'compound': -0.34}",-0.34,Israel Cyber Alerts,,"https://gbhackers.com,https://gbhackers.com,https://gbhackers.com",,
478514542,2025-02-27 09:46:24,"FBI confirms Lazarus hackers were behind $1.5B Bybit crypto heist
https://www.bleepingcomputer.com/news/security/fbi-confirms-lazarus-hackers-were-behind-15b-bybit-crypto-heist/

FBI has confirmed that North Korean hackers stole $1.5 billion from cryptocurrency exchange Bybit on Friday in the largest crypto heist recorded until now. [...]","{'neg': 0.0, 'neu': 1.0, 'pos': 0.0, 'compound': 0.0}",0.0,Israel Cyber Alerts,,https://www.bleepingcomputer.com,,
478514542,2025-02-27 07:57:38,"GitLab Vulnerabilities Allow Attackers to Bypass Security and Run Arbitrary Scripts
https://gbhackers.com/gitlab-vulnerabilities/

GitLab has urgently released security updates to address multiple high-severity vulnerabilities in its platform that could allow attackers to bypass security mechanisms, execute malicious scripts, and access sensitive data. The patches, included in versions 17.9.1, 17.8.4, and 17.7.6 for both Community Edition (CE) and Enterprise Edition (EE), mitigate critical risks affecting Kubernetes integrations, dependency management, […]
The post GitLab Vulnerabilities Allow Attackers to Bypass Security and Run Arbitrary Scripts (https://gbhackers.com/gitlab-vulnerabilities/) appeared first on GBHackers Security | #1 Globally Trusted Cyber Security News Platform (https://gbhackers.com/).","{'neg': 0.172, 'neu': 0.652, 'pos': 0.176, 'compound': -0.3612}",-0.3612,Israel Cyber Alerts,,"https://gbhackers.com,https://gbhackers.com,https://gbhackers.com",,
478514542,2025-02-27 07:56:39,"LibreOffice Flaws Allow Attackers to Run Malicious Files on Windows
https://gbhackers.com/libreoffice-flaws/

A high-severity security vulnerability (CVE-2025-0514) in LibreOffice, the widely used open-source office suite, has been patched after researchers discovered it could allow attackers to execute malicious files on Windows systems by exploiting hyperlink handling mechanisms. The flaw, which impacts versions before 24.8.5, revolves around improper validation of non-file URLs interpreted as Windows file paths through […]
The post LibreOffice Flaws Allow Attackers to Run Malicious Files on Windows (https://gbhackers.com/libreoffice-flaws/) appeared first on GBHackers Security | #1 Globally Trusted Cyber Security News Platform (https://gbhackers.com/).","{'neg': 0.125, 'neu': 0.716, 'pos': 0.159, 'compound': -0.0516}",-0.0516,Israel Cyber Alerts,,"https://gbhackers.com,https://gbhackers.com,https://gbhackers.com",,
478514542,2025-02-27 07:55:38,"Cisco Nexus Switch Vulnerability Allows Attackers to Cause DoS
https://gbhackers.com/cisco-nexus-switch-vulnerability/

Cisco Systems has disclosed a high-severity vulnerability (CVE-2025-20111) in its Nexus 3000 and 9000 Series Switches operating in standalone NX-OS mode. The vulnerability enables unauthenticated attackers to trigger denial of service (DoS) conditions through crafted Ethernet frames. Rated 7.4 on the CVSS v3.1 scale, the flaw affects critical infrastructure components widely used in enterprise and […]
The post Cisco Nexus Switch Vulnerability Allows Attackers to Cause DoS (https://gbhackers.com/cisco-nexus-switch-vulnerability/) appeared first on GBHackers Security | #1 Globally Trusted Cyber Security News Platform (https://gbhackers.com/).","{'neg': 0.12, 'neu': 0.709, 'pos': 0.171, 'compound': 0.5719}",0.5719,Israel Cyber Alerts,,"https://gbhackers.com,https://gbhackers.com,https://gbhackers.com",,
478514542,2025-02-27 01:03:37,"Southern Water says Black Basta ransomware attack cost £4.5M in expenses
https://www.bleepingcomputer.com/news/security/southern-water-says-black-basta-ransomware-attack-cost-45m-in-expenses/

United Kingdom water supplier Southern Water has disclosed that it incurred costs of £4.5 million ($5.7M) due to a cyberattack it suffered in February 2024. [...]","{'neg': 0.238, 'neu': 0.702, 'pos': 0.06, 'compound': -0.8555}",-0.8555,Israel Cyber Alerts,,https://www.bleepingcomputer.com,,
478514542,2025-02-27 01:02:39,"GrassCall malware campaign drains crypto wallets via fake job interviews
https://www.bleepingcomputer.com/news/security/grasscall-malware-campaign-drains-crypto-wallets-via-fake-job-interviews/

A recent social engineering campaign targeted job seekers in the Web3 space with fake job interviews through a malicious ""GrassCall"" meeting app that installs information-stealing malware to steal cryptocurrency wallets. [...]","{'neg': 0.332, 'neu': 0.668, 'pos': 0.0, 'compound': -0.9545}",-0.9545,Israel Cyber Alerts,,https://www.bleepingcomputer.com,,
478514542,2025-02-26 22:22:39,"Poseidon Mac Malware Hiding Within PKG Files to Evade Detections
https://gbhackers.com/poseidon-mac-malware-hiding-within-pkg-files/

A recent discovery by cybersecurity researchers has revealed that the Poseidon malware, a macOS-targeting trojan, is leveraging PKG files with preinstall scripts to infiltrate systems. This malware, weighing only 207 bytes, is currently undetected by VirusTotal and represents a significant threat to Mac users. The preinstall script embedded in the PKG file serves as a […]
The post Poseidon Mac Malware Hiding Within PKG Files to Evade Detections (https://gbhackers.com/poseidon-mac-malware-hiding-within-pkg-files/) appeared first on GBHackers Security | #1 Globally Trusted Cyber Security News Platform (https://gbhackers.com/).","{'neg': 0.212, 'neu': 0.707, 'pos': 0.081, 'compound': -0.9477}",-0.9477,Israel Cyber Alerts,,"https://gbhackers.com,https://gbhackers.com,https://gbhackers.com",,
478514542,2025-02-26 22:21:39,"Windows Virtualization-Based Security Exploited to Develop Highly Evasive Malware
https://gbhackers.com/windows-virtualization-based-security-exploited/

In a groundbreaking development, researchers have uncovered how attackers are exploiting Windows Virtualization-Based Security (VBS) enclaves to create malware that is highly evasive and difficult to detect. VBS enclaves, designed as isolated and secure regions of memory within a process, are being weaponized to bypass traditional security mechanisms, posing a significant threat to enterprise systems. […]
The post Windows Virtualization-Based Security Exploited to Develop Highly Evasive Malware (https://gbhackers.com/windows-virtualization-based-security-exploited/) appeared first on GBHackers Security | #1 Globally Trusted Cyber Security News Platform (https://gbhackers.com/).","{'neg': 0.259, 'neu': 0.523, 'pos': 0.217, 'compound': -0.8551}",-0.8551,Israel Cyber Alerts,,"https://gbhackers.com,https://gbhackers.com,https://gbhackers.com",,
478514542,2025-02-26 22:20:39,"Researchers Uncover $1.4B in Sensitive Data Tied to ByBit Hack by Lazarus Group
https://gbhackers.com/researchers-uncover-1-4b-in-sensitive-data-tied/

In a significant breakthrough, cybersecurity firm Silent Push has uncovered sensitive infrastructure tied to the Lazarus Group, a North Korean state-sponsored Advanced Persistent Threat (APT). This discovery sheds light on the group’s involvement in the historic $1.4 billion cryptocurrency heist targeting ByBit, one of the largest thefts in crypto history. The investigation revealed that the […]
The post Researchers Uncover $1.4B in Sensitive Data Tied to ByBit Hack by Lazarus Group (https://gbhackers.com/researchers-uncover-1-4b-in-sensitive-data-tied/) appeared first on GBHackers Security | #1 Globally Trusted Cyber Security News Platform (https://gbhackers.com/).","{'neg': 0.083, 'neu': 0.817, 'pos': 0.1, 'compound': -0.0258}",-0.0258,Israel Cyber Alerts,,"https://gbhackers.com,https://gbhackers.com,https://gbhackers.com",,
478514542,2025-02-26 22:19:39,"Ransomware Group Data-Leak Sites Increasing as Six New Groups Emerge
https://gbhackers.com/ransomware-group-data-leak-sites/

The cybersecurity landscape has witnessed a significant uptick in ransomware activity, with six new data-leak sites (DLSs) linked to emerging ransomware groups identified in early 2025. According to Cyjax, these groups include Kraken, Morpheus, GD LockerSec, Babuk2, Linkc, and the newly surfaced Anubis. The latter operates as a sophisticated Ransomware-as-a-Service (RaaS) entity, offering affiliates tools […]
The post Ransomware Group Data-Leak Sites Increasing as Six New Groups Emerge (https://gbhackers.com/ransomware-group-data-leak-sites/) appeared first on GBHackers Security | #1 Globally Trusted Cyber Security News Platform (https://gbhackers.com/).","{'neg': 0.175, 'neu': 0.716, 'pos': 0.109, 'compound': -0.91}",-0.91,Israel Cyber Alerts,,"https://gbhackers.com,https://gbhackers.com,https://gbhackers.com",,
478514542,2025-02-26 22:18:39,"Threat Actors Exploit DeepSeek Craze to Distribute Vidar Stealer Malware
https://gbhackers.com/threat-actors-exploit-deepseek-craze/

In a concerning new development, cybercriminals are exploiting the widespread popularity of the recently launched DeepSeek AI chatbot to distribute the Vidar Stealer malware. According to research by Zscaler ThreatLabz, attackers are using brand impersonation tactics to lure unsuspecting users into executing malicious code, thereby compromising sensitive data. Launched on January 20, 2025, DeepSeek quickly […]
The post Threat Actors Exploit DeepSeek Craze to Distribute Vidar Stealer Malware (https://gbhackers.com/threat-actors-exploit-deepseek-craze/) appeared first on GBHackers Security | #1 Globally Trusted Cyber Security News Platform (https://gbhackers.com/).","{'neg': 0.34, 'neu': 0.558, 'pos': 0.102, 'compound': -0.9858}",-0.9858,Israel Cyber Alerts,,"https://gbhackers.com,https://gbhackers.com,https://gbhackers.com",,
478514542,2025-02-26 18:52:42,"Millions of WordPress Websites Vulnerable to Script Injection Due to Plugin Flaw
https://gbhackers.com/millions-of-wordpress-websites-vulnerable/

A critical security vulnerability in the Essential Addons for Elementor plugin, installed on over 2 million WordPress websites, has exposed sites to script injection attacks via malicious URL parameters. The flaw, tracked as CVE-2025-24752 and scoring 7.1 (High) on the CVSS scale, allowed attackers to execute reflected cross-site scripting (XSS) attacks by exploiting insufficient input sanitization in the plugin’s password reset […]
The post Millions of WordPress Websites Vulnerable to Script Injection Due to Plugin Flaw (https://gbhackers.com/millions-of-wordpress-websites-vulnerable/) appeared first on GBHackers Security | #1 Globally Trusted Cyber Security News Platform (https://gbhackers.com/).","{'neg': 0.165, 'neu': 0.734, 'pos': 0.101, 'compound': -0.7717}",-0.7717,Israel Cyber Alerts,,"https://gbhackers.com,https://gbhackers.com,https://gbhackers.com",,
478514542,2025-02-26 18:51:42,"New Undetectable Batch Script Uses PowerShell and Visual Basic to Install XWorm
https://gbhackers.com/powershell-and-visual-basic-to-install-xworm/

A novel malware delivery framework employing advanced obfuscation techniques has evaded detection by security tools for over 48 hours. The attack chain centers around a Batch script that leverages PowerShell and Visual Basic Script (VBS) to deploy either the XWorm remote access trojan or AsyncRAT, marking a significant evolution in fileless attack methodologies, according to […]
The post New Undetectable Batch Script Uses PowerShell and Visual Basic to Install XWorm (https://gbhackers.com/powershell-and-visual-basic-to-install-xworm/) appeared first on GBHackers Security | #1 Globally Trusted Cyber Security News Platform (https://gbhackers.com/).","{'neg': 0.092, 'neu': 0.769, 'pos': 0.139, 'compound': 0.296}",0.296,Israel Cyber Alerts,,"https://gbhackers.com,https://gbhackers.com,https://gbhackers.com",,
478514542,2025-02-26 18:50:43,"2,850+ Ivanti Connect Secure Devices Exposed to Potential Cyberattacks
https://gbhackers.com/2850-ivanti-connect-secure-devices-exposed/

A sweeping cybersecurity alert has emerged as researchers identify 2,850+ unpatched Ivanti Connect Secure devices worldwide, leaving organizations vulnerable to exploitation through the critical flaw designated CVE-2025-22467. The findings, published by cybersecurity watchdog Shadowserver Foundation, reveal systemic risks to virtual private network (VPN) infrastructures relied upon by enterprises and government agencies for secure remote access. Vulnerability Scope and […]
The post 2,850+ Ivanti Connect Secure Devices Exposed to Potential Cyberattacks (https://gbhackers.com/2850-ivanti-connect-secure-devices-exposed/) appeared first on GBHackers Security | #1 Globally Trusted Cyber Security News Platform (https://gbhackers.com/).","{'neg': 0.077, 'neu': 0.68, 'pos': 0.244, 'compound': 0.9698}",0.9698,Israel Cyber Alerts,,"https://gbhackers.com,https://gbhackers.com,https://gbhackers.com",,
478514542,2025-02-26 18:49:42,"US Employee Background Check Firm Hacked, 3 Million Records Exposed
https://gbhackers.com/us-employee-background-check-firm-hacked/

DISA Global Solutions, a Houston-based provider of employee background checks and workplace safety services, disclosed a significant cybersecurity incident exposing the personal information of over 3.3 million individuals, including 15,198 Maine residents. The breach occurred on February 9, 2024, but was not detected until April 22, 2024, according to a data breach notification filed with the […]
The post US Employee Background Check Firm Hacked, 3 Million Records Exposed (https://gbhackers.com/us-employee-background-check-firm-hacked/) appeared first on GBHackers Security | #1 Globally Trusted Cyber Security News Platform (https://gbhackers.com/).","{'neg': 0.179, 'neu': 0.695, 'pos': 0.126, 'compound': -0.775}",-0.775,Israel Cyber Alerts,,"https://gbhackers.com,https://gbhackers.com,https://gbhackers.com",,
478514542,2025-02-26 18:48:43,"Have I Been Pwned Reports Huge Data Leak, Adds 284 Million Stolen Accounts
https://gbhackers.com/have-i-been-pwned-reports-huge-data-leak/

Cybersecurity service Have I Been Pwned (HIBP) has disclosed one of the largest data exposure events in its 11-year history, integrating 23 billion rows of stolen credentials from a malware operation dubbed “ALIEN TXTBASE.” The breach corpus contains 493 million unique website-email pairs tied to 284 million unique email addresses, alongside 244 million new passwords added to HIBP’s […]
The post Have I Been Pwned Reports Huge Data Leak, Adds 284 Million Stolen Accounts (https://gbhackers.com/have-i-been-pwned-reports-huge-data-leak/) appeared first on GBHackers Security | #1 Globally Trusted Cyber Security News Platform (https://gbhackers.com/).","{'neg': 0.193, 'neu': 0.71, 'pos': 0.097, 'compound': -0.9287}",-0.9287,Israel Cyber Alerts,,"https://gbhackers.com,https://gbhackers.com,https://gbhackers.com",,
478514542,2025-02-26 17:26:07,"Australian IVF giant Genea breached by Termite ransomware gang
https://www.bleepingcomputer.com/news/security/australian-ivf-giant-genea-breached-by-termite-ransomware-gang/

​The Termite ransomware gang has claimed responsibility for stealing sensitive healthcare data in a recent breach of Genea, one of Australia's largest fertility services providers. [...]","{'neg': 0.376, 'neu': 0.624, 'pos': 0.0, 'compound': -0.967}",-0.967,Israel Cyber Alerts,,https://www.bleepingcomputer.com,,
478514542,2025-02-25 23:44:37,"Have I Been Pwned adds 284M accounts stolen by infostealer malware
https://www.bleepingcomputer.com/news/security/have-i-been-pwned-adds-284m-accounts-stolen-by-infostealer-malware/

​The Have I Been Pwned data breach notification service has added over 284 million accounts stolen by information stealer malware and found on a Telegram channel. [...]","{'neg': 0.424, 'neu': 0.576, 'pos': 0.0, 'compound': -0.9723}",-0.9723,Israel Cyber Alerts,,https://www.bleepingcomputer.com,,
478514542,2025-02-25 23:41:37,"GitVenom attacks abuse hundreds of GitHub repos to steal crypto
https://www.bleepingcomputer.com/news/security/gitvenom-attacks-abuse-hundreds-of-github-repos-to-steal-crypto/

A malware campaign dubbed GitVenom uses hundreds of GitHub repositories to trick users into downloading info-stealers, remote access trojans (RATs), and clipboard hijackers to steal crypto and credentials. [...]","{'neg': 0.362, 'neu': 0.638, 'pos': 0.0, 'compound': -0.9565}",-0.9565,Israel Cyber Alerts,,https://www.bleepingcomputer.com,,
478514542,2025-02-25 18:48:33,"US drug testing firm DISA says data breach impacts 3.3 million people
https://www.bleepingcomputer.com/news/security/us-drug-testing-firm-disa-says-data-breach-impacts-33-million-people/

DISA Global Solutions, a leading US background screening and drug and alcohol testing firm, has suffered a data breach impacting 3.3 million people. [...]","{'neg': 0.288, 'neu': 0.675, 'pos': 0.037, 'compound': -0.926}",-0.926,Israel Cyber Alerts,,https://www.bleepingcomputer.com,,
