Sender ID,Date,Message,Sentiment,Compound_Sentiment,Channel Name,Affiliated Channel,URLs,IP_Addresses,Hashes
478514542,2025-03-03 14:33:51,"Hackers Abused Google and PayPal’s Infrastructure to Steal Users Personal Data
https://gbhackers.com/hackers-abused-google-and-paypals-infrastructure/

Cybersecurity researchers have uncovered a sophisticated phishing campaign leveraging Google Ads and PayPal’s infrastructure to deceive users and steal sensitive personal data. The attackers exploited vulnerabilities in Google’s ad policies and PayPal’s “no-code checkout” feature to create fraudulent payment links that appeared legitimate, tricking victims into engaging with fake customer support agents. Exploitation of Google […]
The post Hackers Abused Google and PayPal’s Infrastructure to Steal Users Personal Data (https://gbhackers.com/hackers-abused-google-and-paypals-infrastructure/) appeared first on GBHackers Security | #1 Globally Trusted Cyber Security News Platform (https://gbhackers.com/).","{'neg': 0.302, 'neu': 0.554, 'pos': 0.144, 'compound': -0.9712}",-0.9712,Israel Cyber Alerts,,"https://gbhackers.com,https://gbhackers.com,https://gbhackers.com",,
478514542,2025-03-03 14:32:52,"Njrat Exploits Microsoft Dev Tunnels for C2 Communication
https://gbhackers.com/njrat-exploits-microsoft-dev-tunnels/

A new campaign involving the notorious remote access trojan (RAT) Njrat has been uncovered, leveraging Microsoft’s Dev Tunnels service for command-and-control (C2) communication. This service, intended to help developers securely expose local services to the internet for testing and debugging, is being exploited by attackers to establish covert connections with their C2 servers. The abuse […]
The post Njrat Exploits Microsoft Dev Tunnels for C2 Communication (https://gbhackers.com/njrat-exploits-microsoft-dev-tunnels/) appeared first on GBHackers Security | #1 Globally Trusted Cyber Security News Platform (https://gbhackers.com/).","{'neg': 0.186, 'neu': 0.701, 'pos': 0.113, 'compound': -0.8402}",-0.8402,Israel Cyber Alerts,,"https://gbhackers.com,https://gbhackers.com,https://gbhackers.com",,
478514542,2025-03-03 14:31:51,"North Korean IT Workers Hide Their IPs Using Astrill VPN
https://gbhackers.com/north-korean-it-workers-hide-their-ips/

Security researchers have uncovered new evidence that North Korean threat actors, particularly the Lazarus Group, are actively using Astrill VPN to conceal their true IP addresses during cyberattacks and fraudulent IT worker schemes. Silent Push, a cybersecurity firm, recently acquired infrastructure and logs from the Lazarus subgroup known as “Contagious Interview” or “Famous Chollima,” confirming […]
The post North Korean IT Workers Hide Their IPs Using Astrill VPN (https://gbhackers.com/north-korean-it-workers-hide-their-ips/) appeared first on GBHackers Security | #1 Globally Trusted Cyber Security News Platform (https://gbhackers.com/).","{'neg': 0.091, 'neu': 0.775, 'pos': 0.134, 'compound': 0.5574}",0.5574,Israel Cyber Alerts,,"https://gbhackers.com,https://gbhackers.com,https://gbhackers.com",,
478514542,2025-03-03 14:30:51,"Paragon Partition Manager Vulnerabilities Allow Attackers to Escalate Privileges and Trigger DoS Attacks
https://gbhackers.com/paragon-partition-manager-vulnerabilities-allow-attackers/

Security researchers have uncovered five significant vulnerabilities in Paragon Partition Manager’s BioNTdrv.sys driver, affecting versions prior to 2.0.0. These flaws, identified as CVE-2025-0285, CVE-2025-0286, CVE-2025-0287, CVE-2025-0288, and CVE-2025-0289, pose serious security risks, enabling attackers to escalate privileges to SYSTEM level and potentially cause denial-of-service (DoS) scenarios. Multiple Critical Flaws Discovered in BioNTdrv.sys Driver The vulnerabilities, […]
The post Paragon Partition Manager Vulnerabilities Allow Attackers to Escalate Privileges and Trigger DoS Attacks (https://gbhackers.com/paragon-partition-manager-vulnerabilities-allow-attackers/) appeared first on GBHackers Security | #1 Globally Trusted Cyber Security News Platform (https://gbhackers.com/).","{'neg': 0.224, 'neu': 0.587, 'pos': 0.189, 'compound': -0.6705}",-0.6705,Israel Cyber Alerts,,"https://gbhackers.com,https://gbhackers.com,https://gbhackers.com",,
478514542,2025-03-03 14:29:52,"Space Pirates Hackers Attacking IT Organizations With LuckyStrike Using OneDrive
https://gbhackers.com/space-pirates-hackers-attacking-it-organizations/

A recent investigation by cybersecurity experts has unveiled a series of advanced cyberattacks orchestrated by the notorious Advanced Persistent Threat (APT) group known as “Space Pirates.” Leveraging their customized malware arsenal, including the LuckyStrike Agent backdoor, the group has been targeting IT organizations and government agencies across Russia and neighboring regions. The attacks have been […]
The post Space Pirates Hackers Attacking IT Organizations With LuckyStrike Using OneDrive (https://gbhackers.com/space-pirates-hackers-attacking-it-organizations/) appeared first on GBHackers Security | #1 Globally Trusted Cyber Security News Platform (https://gbhackers.com/).","{'neg': 0.202, 'neu': 0.7, 'pos': 0.098, 'compound': -0.9287}",-0.9287,Israel Cyber Alerts,,"https://gbhackers.com,https://gbhackers.com,https://gbhackers.com",,
478514542,2025-03-02 07:08:43,"Hackers can Crack Into Car Cameras Within Minutes Exploiting Vulnerabilities
https://gbhackers.com/hackers-can-crack-into-car-cameras/

At the upcoming Black Hat Asia 2025 conference, cybersecurity experts will unveil a groundbreaking vulnerability in modern dashcam technology, exposing how hackers can exploit these devices to breach privacy and steal sensitive data. The session, titled DriveThru Car Hacking: Fast Food, Faster Data Breach, will be held on April 3, 2025, at Marina Bay Sands, […]
The post Hackers can Crack Into Car Cameras Within Minutes Exploiting Vulnerabilities (https://gbhackers.com/hackers-can-crack-into-car-cameras/) appeared first on GBHackers Security | #1 Globally Trusted Cyber Security News Platform (https://gbhackers.com/).","{'neg': 0.241, 'neu': 0.673, 'pos': 0.086, 'compound': -0.9595}",-0.9595,Israel Cyber Alerts,,"https://gbhackers.com,https://gbhackers.com,https://gbhackers.com",,
478514542,2025-03-02 00:39:34,"Ransomware gangs exploit Paragon Partition Manager bug in BYOVD attacks
https://www.bleepingcomputer.com/news/security/ransomware-gangs-exploit-paragon-partition-manager-bug-in-byovd-attacks/

Microsoft had discovered five Paragon Partition Manager BioNTdrv.sys driver flaws, with one used by ransomware gangs in zero-day attacks to gain SYSTEM privileges in Windows. [...]","{'neg': 0.415, 'neu': 0.485, 'pos': 0.1, 'compound': -0.9674}",-0.9674,Israel Cyber Alerts,,https://www.bleepingcomputer.com,,
478514542,2025-03-01 01:58:43,"U.S. recovers $31 million stolen in 2021 Uranium Finance hack
https://www.bleepingcomputer.com/news/cryptocurrency/us-recovers-31-million-stolen-in-2021-uranium-finance-hack/

U.S. authorities recovered $31 million in cryptocurrency stolen in 2021 cyberattacks on Uranium Finance, a Binance Smart Chain-based DeFi protocol. [...]","{'neg': 0.24, 'neu': 0.691, 'pos': 0.069, 'compound': -0.7717}",-0.7717,Israel Cyber Alerts,,https://www.bleepingcomputer.com,,
478514542,2025-02-28 23:39:54,"Notorious Malware, Spam Host “Prospero” Moves to Kaspersky Lab
https://krebsonsecurity.com/2025/02/notorious-malware-spam-host-prospero-moves-to-kaspersky-lab/

One of the most notorious providers of abuse-friendly ""bulletproof"" web hosting for cybercriminals has started routing its operations through networks run by the Russian antivirus and security firm Kaspersky Lab, KrebsOnSecurity has learned.","{'neg': 0.239, 'neu': 0.723, 'pos': 0.038, 'compound': -0.8908}",-0.8908,Israel Cyber Alerts,,https://krebsonsecurity.com,,
478514542,2025-02-28 20:33:19,"Chinese Hackers Breach Belgium State Security Service as Investigation Continues
https://gbhackers.com/chinese-hackers-breach-belgium-state-security-service/

Belgium’s State Security Service (VSSE) has suffered what is being described as its most severe security breach to date. For nearly two years, a group of Chinese hackers exploited a vulnerability in Barracuda’s Email Security Gateway Appliance, a cybersecurity tool used by the VSSE, to access approximately 10% of the agency’s email traffic. The breach, […]
The post Chinese Hackers Breach Belgium State Security Service as Investigation Continues (https://gbhackers.com/chinese-hackers-breach-belgium-state-security-service/) appeared first on GBHackers Security | #1 Globally Trusted Cyber Security News Platform (https://gbhackers.com/).","{'neg': 0.239, 'neu': 0.597, 'pos': 0.164, 'compound': -0.9455}",-0.9455,Israel Cyber Alerts,,"https://gbhackers.com,https://gbhackers.com,https://gbhackers.com",,
478514542,2025-02-28 20:32:20,"Hacktivist Groups Emerge With Powerful Tools for Large-Scale Cyber Operations
https://gbhackers.com/hacktivist-groups-emerge-with-powerful-tools/

Hacktivism, once synonymous with symbolic website defacements and distributed denial-of-service (DDoS) attacks, has evolved into a sophisticated tool for cyber warfare and influence operations. Recent research highlights how state-sponsored actors are increasingly leveraging hacktivist tactics to conduct large-scale cyber campaigns, blurring the lines between grassroots activism and government-directed operations. These groups, often cloaked in anonymity […]
The post Hacktivist Groups Emerge With Powerful Tools for Large-Scale Cyber Operations (https://gbhackers.com/hacktivist-groups-emerge-with-powerful-tools/) appeared first on GBHackers Security | #1 Globally Trusted Cyber Security News Platform (https://gbhackers.com/).","{'neg': 0.048, 'neu': 0.797, 'pos': 0.155, 'compound': 0.8807}",0.8807,Israel Cyber Alerts,,"https://gbhackers.com,https://gbhackers.com,https://gbhackers.com",,
478514542,2025-02-28 20:06:55,"Qilin ransomware claims attack at Lee Enterprises, leaks stolen data
https://www.bleepingcomputer.com/news/security/qilin-ransomware-claims-attack-at-lee-enterprises-leaks-stolen-data/

The Qilin ransomware gang has claimed responsibility for the attack at Lee Enterprises that disrupted operations on February 3, leaking samples of data they claim was stolen from the company. [...]","{'neg': 0.384, 'neu': 0.616, 'pos': 0.0, 'compound': -0.9732}",-0.9732,Israel Cyber Alerts,,https://www.bleepingcomputer.com,,
478514542,2025-02-28 20:04:56,"Serbian police used Cellebrite zero-day hack to unlock Android phones
https://www.bleepingcomputer.com/news/security/serbian-police-used-cellebrite-zero-day-hack-to-unlock-android-phones/

Serbian authorities have reportedly used an Android zero-day exploit chain developed by Cellebrite to unlock the device of a student activist in the country and attempt to install spyware. [...]","{'neg': 0.321, 'neu': 0.679, 'pos': 0.0, 'compound': -0.9584}",-0.9584,Israel Cyber Alerts,,https://www.bleepingcomputer.com,,
478514542,2025-02-28 14:39:15,"New Pass-the-Cookie Attacks Bypass MFA, Giving Hackers Full Account Access
https://gbhackers.com/new-pass-the-cookie-attacks-bypass-mfa/

Multi-factor authentication (MFA), long considered a cornerstone of cybersecurity defense, is facing a formidable new threat: “Pass-the-Cookie” attacks. Recent findings reveal from Long Wall shows that threat actors exploit browser session cookies to bypass MFA entirely, granting full access to corporate accounts without requiring passwords or authentication tokens. This technique poses a significant risk to organizations […]
The post New Pass-the-Cookie Attacks Bypass MFA, Giving Hackers Full Account Access (https://gbhackers.com/new-pass-the-cookie-attacks-bypass-mfa/) appeared first on GBHackers Security | #1 Globally Trusted Cyber Security News Platform (https://gbhackers.com/).","{'neg': 0.173, 'neu': 0.616, 'pos': 0.211, 'compound': 0.3597}",0.3597,Israel Cyber Alerts,,"https://gbhackers.com,https://gbhackers.com,https://gbhackers.com",,
478514542,2025-02-28 10:01:29,"Chinese Hackers Exploit Check Point VPN Zero-Day to Target Organizations Globally
https://gbhackers.com/chinese-hackers-exploit-check-point-vpn-zero-day/

A sophisticated cyberespionage campaign linked to Chinese state-sponsored actors has exploited a previously patched Check Point VPN vulnerability (CVE-2024-24919) to infiltrate organizations across Europe, Africa, and the Americas, according to cybersecurity researchers. The attacks, observed between June 2024 and January 2025, primarily targeted the manufacturing sector, deploying ShadowPad malware and, in limited cases, the NailaoLocker […]
The post Chinese Hackers Exploit Check Point VPN Zero-Day to Target Organizations Globally (https://gbhackers.com/chinese-hackers-exploit-check-point-vpn-zero-day/) appeared first on GBHackers Security | #1 Globally Trusted Cyber Security News Platform (https://gbhackers.com/).","{'neg': 0.241, 'neu': 0.648, 'pos': 0.111, 'compound': -0.959}",-0.959,Israel Cyber Alerts,,"https://gbhackers.com,https://gbhackers.com,https://gbhackers.com",,
478514542,2025-02-28 10:00:28,"PingAM Java Agent Vulnerability Allows Attackers to Bypass Security
https://gbhackers.com/pingam-java-agent-vulnerability/

A critical security flaw (CVE-2025-20059) has been identified in supported versions of Ping Identity’s PingAM Java Agent, potentially enabling attackers to bypass policy enforcement and access protected resources. The vulnerability—classified as a Relative Path Traversal (CWE-23) weakness—affects all PingAM Java Agent deployments integrated with PingOne Advanced Identity Cloud, prompting urgent calls for remediation. Vulnerability Scope and Severity […]
The post PingAM Java Agent Vulnerability Allows Attackers to Bypass Security (https://gbhackers.com/pingam-java-agent-vulnerability/) appeared first on GBHackers Security | #1 Globally Trusted Cyber Security News Platform (https://gbhackers.com/).","{'neg': 0.113, 'neu': 0.624, 'pos': 0.262, 'compound': 0.9136}",0.9136,Israel Cyber Alerts,,"https://gbhackers.com,https://gbhackers.com,https://gbhackers.com",,
478514542,2025-02-28 09:59:28,"New GitHub Scam Uses Fake “Mods” and “Cracks” to Steal User Data
https://gbhackers.com/new-github-scam/

A sophisticated malware campaign leveraging GitHub repositories disguised as game modifications and cracked software has been uncovered, exposing a dangerous convergence of social engineering tactics and automated credential harvesting. Security researchers identified over 1,100 malicious repositories distributing variants of the Redox stealer, a Python-based malware designed to exfiltrate sensitive data including cryptocurrency wallet keys, browser cookies, […]
The post New GitHub Scam Uses Fake “Mods” and “Cracks” to Steal User Data (https://gbhackers.com/new-github-scam/) appeared first on GBHackers Security | #1 Globally Trusted Cyber Security News Platform (https://gbhackers.com/).","{'neg': 0.295, 'neu': 0.606, 'pos': 0.099, 'compound': -0.9783}",-0.9783,Israel Cyber Alerts,,"https://gbhackers.com,https://gbhackers.com,https://gbhackers.com",,
478514542,2025-02-28 09:58:29,"260 Domains Hosting 5,000 Malicious PDFs to Steal Credit Card Data
https://gbhackers.com/260-domains-hosting-5000-malicious-pdfs/

Netskope Threat Labs uncovered a sprawling phishing operation involving 260 domains hosting approximately 5,000 malicious PDF files. These documents, disguised as legitimate resources, employ fake CAPTCHA prompts to redirect victims to phishing sites designed to harvest credit card details and personal information. The campaign, active since the second half of 2024, has impacted over 1,150 […]
The post 260 Domains Hosting 5,000 Malicious PDFs to Steal Credit Card Data (https://gbhackers.com/260-domains-hosting-5000-malicious-pdfs/) appeared first on GBHackers Security | #1 Globally Trusted Cyber Security News Platform (https://gbhackers.com/).","{'neg': 0.205, 'neu': 0.65, 'pos': 0.145, 'compound': -0.8519}",-0.8519,Israel Cyber Alerts,,"https://gbhackers.com,https://gbhackers.com,https://gbhackers.com",,
478514542,2025-02-28 07:57:46,"Winos4.0 Malware Targets Windows Users Through Malicious PDF Files
https://gbhackers.com/winos4-0-malware-targets-windows/

A new wave of cyberattacks leveraging the Winos4.0 malware framework has targeted organizations in Taiwan through malicious PDF attachments disguised as tax inspection alerts, according to a January 2025 threat analysis by FortiGuard Labs.  The campaign employs multi-stage payload delivery, anti-forensic techniques, and automated security bypass mechanisms to establish persistent access to victim networks while […]
The post Winos4.0 Malware Targets Windows Users Through Malicious PDF Files (https://gbhackers.com/winos4-0-malware-targets-windows/) appeared first on GBHackers Security | #1 Globally Trusted Cyber Security News Platform (https://gbhackers.com/).","{'neg': 0.177, 'neu': 0.72, 'pos': 0.103, 'compound': -0.875}",-0.875,Israel Cyber Alerts,,"https://gbhackers.com,https://gbhackers.com,https://gbhackers.com",,
478514542,2025-02-28 07:56:48,"DeepSeek Data Leak Exposes 12,000 Hardcoded API Keys and Passwords
https://gbhackers.com/deepseek-data-leak-exposes-api-keys/

A sweeping analysis of the Common Crawl dataset—a cornerstone of training data for large language models (LLMs) like DeepSeek—has uncovered 11,908 live API keys, passwords, and credentials embedded in publicly accessible web pages.  The leaked secrets, which authenticate successfully with services ranging from AWS to Slack and Mailchimp, highlight systemic risks in AI development pipelines […]
The post DeepSeek Data Leak Exposes 12,000 Hardcoded API Keys and Passwords (https://gbhackers.com/deepseek-data-leak-exposes-api-keys/) appeared first on GBHackers Security | #1 Globally Trusted Cyber Security News Platform (https://gbhackers.com/).","{'neg': 0.114, 'neu': 0.745, 'pos': 0.142, 'compound': 0.6124}",0.6124,Israel Cyber Alerts,,"https://gbhackers.com,https://gbhackers.com,https://gbhackers.com",,
478514542,2025-02-28 00:52:11,"Vo1d malware botnet grows to 1.6 million Android TVs worldwide
https://www.bleepingcomputer.com/news/security/vo1d-malware-botnet-grows-to-16-million-android-tvs-worldwide/

A new variant of the Vo1d malware botnet has grown to 1,590,299 infected Android TV devices across 226 countries, recruiting devices as part of anonymous proxy server networks. [...]","{'neg': 0.237, 'neu': 0.763, 'pos': 0.0, 'compound': -0.9042}",-0.9042,Israel Cyber Alerts,,https://www.bleepingcomputer.com,,
478514542,2025-02-28 00:22:15,"New Malware Uses Legitimate Antivirus Driver to Bypass All System Protections
https://gbhackers.com/new-malware-uses-legitimate-antivirus-driver/

In a concerning development, cybersecurity researchers at Trellix have uncovered a sophisticated malware campaign that exploits a legitimate antivirus driver to bypass system protections. The malware, identified as “kill-floor.exe,” leverages the Avast Anti-Rootkit driver (aswArPot.sys) to gain kernel-level access, effectively neutralizing security software and taking control of infected systems. This tactic highlights the growing trend […]
The post New Malware Uses Legitimate Antivirus Driver to Bypass All System Protections (https://gbhackers.com/new-malware-uses-legitimate-antivirus-driver/) appeared first on GBHackers Security | #1 Globally Trusted Cyber Security News Platform (https://gbhackers.com/).","{'neg': 0.18, 'neu': 0.648, 'pos': 0.172, 'compound': -0.5994}",-0.5994,Israel Cyber Alerts,,"https://gbhackers.com,https://gbhackers.com,https://gbhackers.com",,
478514542,2025-02-28 00:21:14,"VS Code Extension with 9 Million Installs Attacks Developers with Malicious Code
https://gbhackers.com/vs-code-extension-with-9-million-installs-attacks/

Microsoft has removed two widely-used Visual Studio Code (VS Code) extensions, “Material Theme Free” and “Material Theme Icons Free,” from its marketplace after cybersecurity researchers discovered malicious code embedded within them. These extensions, developed by Mattia Astorino (also known as equinusocio), had amassed nearly 9 million installations combined, with Astorino’s total extension downloads exceeding 13 […]
The post VS Code Extension with 9 Million Installs Attacks Developers with Malicious Code (https://gbhackers.com/vs-code-extension-with-9-million-installs-attacks/) appeared first on GBHackers Security | #1 Globally Trusted Cyber Security News Platform (https://gbhackers.com/).","{'neg': 0.057, 'neu': 0.873, 'pos': 0.07, 'compound': 0.0772}",0.0772,Israel Cyber Alerts,,"https://gbhackers.com,https://gbhackers.com,https://gbhackers.com",,
478514542,2025-02-28 00:20:15,"New Anubis Ransomware Targets Windows, Linux, NAS, and ESXi x64/x32 Environments
https://gbhackers.com/new-anubis-ransomware-targets-windows-linux-nas-and-esxi/

A new ransomware group, dubbed Anubis, has emerged as a significant threat in the cybersecurity landscape. Active since late 2024, Anubis employs advanced techniques and operates across multiple platforms, including Windows, Linux, NAS, and ESXi environments. The group is leveraging ransomware-as-a-service (RaaS) and other affiliate-based monetization models to expand its reach and impact. Technical Capabilities […]
The post New Anubis Ransomware Targets Windows, Linux, NAS, and ESXi x64/x32 Environments (https://gbhackers.com/new-anubis-ransomware-targets-windows-linux-nas-and-esxi/) appeared first on GBHackers Security | #1 Globally Trusted Cyber Security News Platform (https://gbhackers.com/).","{'neg': 0.155, 'neu': 0.698, 'pos': 0.147, 'compound': -0.7906}",-0.7906,Israel Cyber Alerts,,"https://gbhackers.com,https://gbhackers.com,https://gbhackers.com",,
478514542,2025-02-28 00:19:14,"WordPress Admins Warned of Fake Plugins Injecting Malicious Links into Websites
https://gbhackers.com/wordpress-admins-warned-of-fake-plugins/

A new wave of cyberattacks targeting WordPress websites has been uncovered, with attackers leveraging fake plugins to inject malicious links into site footers. These links, often promoting casino-related spam, compromise website integrity and can severely impact search engine optimization (SEO). The attackers use sophisticated techniques to disguise their malicious plugins, making detection and removal challenging […]
The post WordPress Admins Warned of Fake Plugins Injecting Malicious Links into Websites (https://gbhackers.com/wordpress-admins-warned-of-fake-plugins/) appeared first on GBHackers Security | #1 Globally Trusted Cyber Security News Platform (https://gbhackers.com/).","{'neg': 0.254, 'neu': 0.589, 'pos': 0.157, 'compound': -0.9246}",-0.9246,Israel Cyber Alerts,,"https://gbhackers.com,https://gbhackers.com,https://gbhackers.com",,
478514542,2025-02-28 00:18:16,"LARVA-208 Hackers Compromise 618 Organizations Stealing Logins and Deploying Ransomware
https://gbhackers.com/larva-208-hackers-compromise-618-organizations-stealing-logins/

A newly identified cybercriminal group, LARVA-208, also known as EncryptHub, has successfully infiltrated 618 organizations globally since June 2024, leveraging advanced social engineering techniques to steal credentials and deploy ransomware. According to reports from cybersecurity firms CATALYST and Prodaft, the group has demonstrated a high level of sophistication in its operations, targeting corporate networks through […]
The post LARVA-208 Hackers Compromise 618 Organizations Stealing Logins and Deploying Ransomware (https://gbhackers.com/larva-208-hackers-compromise-618-organizations-stealing-logins/) appeared first on GBHackers Security | #1 Globally Trusted Cyber Security News Platform (https://gbhackers.com/).","{'neg': 0.271, 'neu': 0.63, 'pos': 0.099, 'compound': -0.9783}",-0.9783,Israel Cyber Alerts,,"https://gbhackers.com,https://gbhackers.com,https://gbhackers.com",,
478514542,2025-02-27 22:17:25,"Privacy tech firms warn France’s encryption and VPN laws threaten privacy
https://www.bleepingcomputer.com/news/security/privacy-tech-firms-warn-frances-encryption-and-vpn-laws-threaten-privacy/

Privacy-focused email provider Tuta (previously Tutanota) and the VPN Trust Initiative (VTI) are raising concerns over proposed laws in France set to backdoor encrypted messaging systems and restrict internet access. [...]","{'neg': 0.197, 'neu': 0.686, 'pos': 0.117, 'compound': -0.5106}",-0.5106,Israel Cyber Alerts,,https://www.bleepingcomputer.com,,
478514542,2025-02-27 19:47:12,"Microsoft names cybercriminals behind AI deepfake network
https://www.bleepingcomputer.com/news/microsoft/microsoft-names-cybercriminals-behind-ai-deepfake-network/

Microsoft has named multiple threat actors part of a cybercrime gang accused of developing malicious tools capable of bypassing generative AI guardrails to generate celebrity deepfakes and other illicit content. [...]","{'neg': 0.121, 'neu': 0.818, 'pos': 0.061, 'compound': -0.3818}",-0.3818,Israel Cyber Alerts,,https://www.bleepingcomputer.com,,
478514542,2025-02-27 19:45:14,"Belgium probes if Chinese hackers breached its intelligence service
https://www.bleepingcomputer.com/news/security/belgium-probes-if-chinese-hackers-breached-its-intelligence-service/

​The Belgian federal prosecutor's office is investigating whether Chinese hackers were behind a breach of the country's State Security Service (VSSE). [...]","{'neg': 0.131, 'neu': 0.735, 'pos': 0.134, 'compound': -0.2263}",-0.2263,Israel Cyber Alerts,,https://www.bleepingcomputer.com,,
